{"mission_blueprint_ids":"mission.salvage_run.machine_silo,mission.timed_extraction.machine_silo,mission.recover_artifact.sky_docks,mission.activate_machine.sky_docks,mission.escort_companion.relay_tunnels,mission.salvage_run.relay_tunnels","style_profile_ids":"style.zone.machine_silo,style.zone.sky_docks,style.zone.relay_tunnels","encounter_pattern_ids":"encounter.machine_silo.patrol_pair,encounter.machine_silo.guard_post,encounter.machine_silo.vault_watch,encounter.sky_docks.artifact_watch,encounter.sky_docks.launch_lane,encounter.relay_tunnels.escort_gauntlet,encounter.relay_tunnels.extraction_rush","id":"content_manifest.phase5","room_variant_ids":"room_variant.machine_silo.entry_platform,room_variant.machine_silo.patrol_hall,room_variant.machine_silo.salvage_nook,room_variant.machine_silo.guard_post,room_variant.machine_silo.generator_room,room_variant.machine_silo.high_risk_vault,room_variant.machine_silo.extraction_pad,room_variant.sky_docks.cargo_crossroads,room_variant.sky_docks.wind_corridor,room_variant.sky_docks.artifact_vault,room_variant.sky_docks.maintenance_bypass,room_variant.sky_docks.launch_pad,room_variant.relay_tunnels.long_corridor,room_variant.relay_tunnels.ambush_fork,room_variant.relay_tunnels.catwalk_run,room_variant.relay_tunnels.extraction_lift"}
